{"authority_source":"contract","authorization":{"authorization_id":"0x11aeb8de8c0537ed951126bd3cdc6ebdcdf6311cfdb6164dde3d4ec3b681f593","consumed":false,"consumed_order_id":null,"exists":true,"issued_count":0,"issued_use_units":0,"policy_hash":"0x94ad0e04d9fd76b83ca40e8cd52e459160e1aae3fd0f7ae1ab850f3d1bd67817","reserved_count":0,"reserved_use_units":0,"status":"Active"},"baseline_id":"B1","contract_version":"phase3-adapter-contract-v1","evidence":{"pre_state_commitment":null,"record_fields_hash":null,"settlement_id":null,"settlement_record_count":0},"identity":{"authorization_nonce":null,"buyer_nonce":1,"object_state_version":1,"order_commitment_hash":"0x9c192c563098928c400cc1214811f8a0c43e6283996ace3970b25f0028b7ee9b","seller_nonce":1,"settlement_domain_id":"axc/p2/shared","settlement_protocol_version":1},"market":{"active_exposure_value":"4000000000000","active_orders":1,"capabilities":["TransferMeta","IssueRight","TransferRight"],"exists":true,"funded_orders":1,"market_id":"0x6de0578ed7f29849f1599ab8b0be77a668e632e018c85157bf23f09961e8771d","status":"0"},"meta":{"active_order_id":null,"active_right_count":1,"asset_id":"0x6363636363636363636363636363636363636363636363636363636363636363","exists":true,"owner":"0xd43593c715fdd31c61141abd04a99fd6822c8558854ccde39a5684e7a56da27d","owner_index_matches":true,"state_version":1,"status":"Tradable"},"observed_at":{"attempt_sequence":3,"block_number":19},"order":{"active_capacity_occupied":true,"buyer":"0x306721211d5404bd9da88e0204360a1a9ab8b87c66c1bc2fcdd37f3c2222cc20","exists":true,"expiry":38,"funded_capacity_occupied":true,"grace_deadline":29,"operation":"TransferRight","order_id":"0xb2c8da72b827a948f9b9ec1828dcd25e9f4ee7441afa67061f10c664c08dcbe6","seller":"0x8eaf04151687736326c9fea17e25fc5287613693c912909cb226aa4794f26a48","state":"Funded"},"payment":{"buyer_balance":"99972654920016735","escrow_amount":"4000000000000","market_balance":"100000000000000000","royalty_balance":null,"safety_balance":null,"seller_balance":"1267650600228229401496703205376","state":"Escrowed"},"projection":{"authoritative":false,"availability":"N/A","order_state":null,"settlement_record_count":null},"right":{"active_order_id":"0xb2c8da72b827a948f9b9ec1828dcd25e9f4ee7441afa67061f10c664c08dcbe6","exists":true,"holder":"0x8eaf04151687736326c9fea17e25fc5287613693c912909cb226aa4794f26a48","holder_index_matches":true,"parent_asset_id":"0x6363636363636363636363636363636363636363636363636363636363636363","parent_index_matches":true,"remaining_uses":1,"right_id":"0x7373737373737373737373737373737373737373737373737373737373737373","state_version":1,"status":"Active","valid":true},"schema_id":"assetxchain-exp2-normalized-snapshot","schema_version":1,"state_commitment":"0x38f23524e148b03147c8b204f01efad7ef763aad3f1ed5fa63f98646aadfa873"}
