{"authority_source":"contract","authorization":{"authorization_id":"0x15ffc9d1a54610748ef5a5f85829b5372c049900cd941cb45c155136ce2508e3","consumed":false,"consumed_order_id":null,"exists":true,"issued_count":0,"issued_use_units":0,"policy_hash":"0x53572b80fa7554668a6382b40d4cb053cd7f41d4bf187bbb4a984eaeb2686f5a","reserved_count":0,"reserved_use_units":0,"status":"0"},"baseline_id":"B1","contract_version":"phase3-adapter-contract-v1","evidence":{"pre_state_commitment":null,"record_fields_hash":null,"settlement_id":null,"settlement_record_count":0},"identity":{"authorization_nonce":1,"buyer_nonce":null,"object_state_version":1,"order_commitment_hash":"0x142599ec53a03261f23a3a75941411360840f901830a6db94b1ad4dc16c7c2f4","seller_nonce":1,"settlement_domain_id":"axc/p2/shared","settlement_protocol_version":1},"market":{"active_exposure_value":"0","active_orders":0,"capabilities":["TransferMeta","IssueRight","TransferRight"],"exists":true,"funded_orders":0,"market_id":"0xf1e1b1add3ea16ff2c83942fa072740be14523a5ca6bcbb8174cee6e7b6a1807","status":"0"},"meta":{"active_order_id":null,"active_right_count":0,"asset_id":"0x6161616161616161616161616161616161616161616161616161616161616161","exists":true,"owner":"0xd43593c715fdd31c61141abd04a99fd6822c8558854ccde39a5684e7a56da27d","owner_index_matches":true,"state_version":1,"status":"Tradable"},"observed_at":{"attempt_sequence":1,"block_number":19},"order":{"active_capacity_occupied":false,"buyer":null,"exists":true,"expiry":38,"funded_capacity_occupied":false,"grace_deadline":null,"operation":"TransferMeta","order_id":"0xba3ef683130520c3294dd3c76fa3d0c068e2b3f30c03c2dc3c52e6d30ebc4065","seller":"0xd43593c715fdd31c61141abd04a99fd6822c8558854ccde39a5684e7a56da27d","state":"Cancelled"},"payment":{"buyer_balance":"100000000000000000","escrow_amount":"0","market_balance":"100000000000000000","royalty_balance":null,"safety_balance":null,"seller_balance":"1267650600227819268024092701182","state":"Unfunded"},"projection":{"authoritative":false,"availability":"N/A","order_state":null,"settlement_record_count":null},"right":{"active_order_id":null,"exists":false,"holder":null,"holder_index_matches":null,"parent_asset_id":null,"parent_index_matches":null,"remaining_uses":null,"right_id":null,"state_version":null,"status":null,"valid":null},"schema_id":"assetxchain-exp2-normalized-snapshot","schema_version":1,"state_commitment":"0xee1b86e58ae461625efd715b56606e7290a25d24cf81dcea5de31526a04ca43f"}
