{"authority_source":"runtime","authorization":{"authorization_id":"0x93e06d410425ec4f12126dcac045f2c5a43c528e8a25b353ed210a33b4b5c566","consumed":false,"consumed_order_id":null,"exists":true,"issued_count":0,"issued_use_units":0,"policy_hash":"0x53572b80fa7554668a6382b40d4cb053cd7f41d4bf187bbb4a984eaeb2686f5a","reserved_count":0,"reserved_use_units":0,"status":"Active"},"baseline_id":"G3","contract_version":"phase3-adapter-contract-v1","evidence":{"pre_state_commitment":null,"record_fields_hash":null,"settlement_id":null,"settlement_record_count":0},"identity":{"authorization_nonce":0,"buyer_nonce":1,"object_state_version":1,"order_commitment_hash":"0x5424762b5746e38647827a3c0d22b878fb1abd8288cf7e44baa0376cdac46356","seller_nonce":1,"settlement_domain_id":"axc/p2/shared","settlement_protocol_version":1},"market":{"active_exposure_value":"10000000000000","active_orders":1,"capabilities":["TransferMeta","IssueRight","TransferRight"],"exists":true,"funded_orders":1,"market_id":"0x76bbb037e82c0a137ba49f02df24419c4aa7b2ded91b429397181113fbc98f9e","status":"Active"},"meta":{"active_order_id":"0x49307650c62bd28c8fd4ca0727756425506c35eb29229ec477e705d43d564b29","active_right_count":0,"asset_id":"0x7989fdcb74618d3db2cc16ccebaba3c24cc759b55b57ec9baddde3a54338b060","exists":true,"owner":"0xd43593c715fdd31c61141abd04a99fd6822c8558854ccde39a5684e7a56da27d","owner_index_matches":true,"state_version":1,"status":"Tradable"},"observed_at":{"attempt_sequence":3,"block_number":20},"order":{"active_capacity_occupied":true,"buyer":"0x90b5ab205c6974c9ea841be688864633dc9ca8a357843eeacf2314649965fe22","exists":true,"expiry":39,"funded_capacity_occupied":true,"grace_deadline":30,"operation":"TransferMeta","order_id":"0x49307650c62bd28c8fd4ca0727756425506c35eb29229ec477e705d43d564b29","seller":"0xd43593c715fdd31c61141abd04a99fd6822c8558854ccde39a5684e7a56da27d","state":"Funded"},"payment":{"buyer_balance":"99989997018627614","escrow_amount":"10000000000000","market_balance":"88028940260265198","royalty_balance":null,"safety_balance":null,"seller_balance":"1267650600227829501491612200374","state":"Escrowed"},"projection":{"authoritative":false,"availability":"unavailable","order_state":null,"settlement_record_count":null},"right":{"active_order_id":null,"exists":false,"holder":null,"holder_index_matches":null,"parent_asset_id":null,"parent_index_matches":null,"remaining_uses":null,"right_id":null,"state_version":null,"status":null,"valid":null},"schema_id":"assetxchain-exp2-normalized-snapshot","schema_version":1,"state_commitment":"0x5fbac2f00db4cda10f85a2ddafe41b4ded6512a614c4add176c0f83360469bca"}
