{"authority_source":"contract","authorization":{"authorization_id":"0xce5c3bf35e2550c24a81319e63d31045dd137b3f245d0fe74a1e04391762b750","consumed":false,"consumed_order_id":null,"exists":true,"issued_count":0,"issued_use_units":0,"policy_hash":"0x94ad0e04d9fd76b83ca40e8cd52e459160e1aae3fd0f7ae1ab850f3d1bd67817","reserved_count":0,"reserved_use_units":0,"status":"Active"},"baseline_id":"B1","contract_version":"phase3-adapter-contract-v1","evidence":{"pre_state_commitment":null,"record_fields_hash":null,"settlement_id":null,"settlement_record_count":0},"identity":{"authorization_nonce":null,"buyer_nonce":null,"object_state_version":1,"order_commitment_hash":"0x1f3faadb78c9385cd31036e50960571e50bd32d5c8289e4c6746791cd68185a3","seller_nonce":1,"settlement_domain_id":"axc/p2/shared","settlement_protocol_version":1},"market":{"active_exposure_value":"0","active_orders":1,"capabilities":["TransferMeta","IssueRight","TransferRight"],"exists":true,"funded_orders":0,"market_id":"0x2b5809f7d5e5ea5a2c77350683eceafda3de7261692e55cd662ce5c64f38b675","status":"0"},"meta":{"active_order_id":null,"active_right_count":1,"asset_id":"0x6363636363636363636363636363636363636363636363636363636363636363","exists":true,"owner":"0xd43593c715fdd31c61141abd04a99fd6822c8558854ccde39a5684e7a56da27d","owner_index_matches":true,"state_version":1,"status":"Tradable"},"observed_at":{"attempt_sequence":1,"block_number":19},"order":{"active_capacity_occupied":true,"buyer":null,"exists":true,"expiry":38,"funded_capacity_occupied":false,"grace_deadline":null,"operation":"TransferRight","order_id":"0xab0db0e3b70b19c266fb63623e0134049bcbf1061d0653f8c9f86cfe8e4ab1a8","seller":"0x8eaf04151687736326c9fea17e25fc5287613693c912909cb226aa4794f26a48","state":"Open"},"payment":{"buyer_balance":"100000000000000000","escrow_amount":"0","market_balance":"100000000000000000","royalty_balance":null,"safety_balance":null,"seller_balance":"1267650600228229401496703205376","state":"Unfunded"},"projection":{"authoritative":false,"availability":"N/A","order_state":null,"settlement_record_count":null},"right":{"active_order_id":"0xab0db0e3b70b19c266fb63623e0134049bcbf1061d0653f8c9f86cfe8e4ab1a8","exists":true,"holder":"0x8eaf04151687736326c9fea17e25fc5287613693c912909cb226aa4794f26a48","holder_index_matches":true,"parent_asset_id":"0x6363636363636363636363636363636363636363636363636363636363636363","parent_index_matches":true,"remaining_uses":1,"right_id":"0x7373737373737373737373737373737373737373737373737373737373737373","state_version":1,"status":"Active","valid":true},"schema_id":"assetxchain-exp2-normalized-snapshot","schema_version":1,"state_commitment":"0x142fd442a9aaef52e9e8e21f0a47b69168ac720c6d96a999c052ccff65588721"}
