{"authority_source":"contract","authorization":{"authorization_id":"0x213e683b0bb3793ee88b0e3773dda12b4359cde9d654d5d8e073c23d175c30b1","consumed":false,"consumed_order_id":null,"exists":true,"issued_count":0,"issued_use_units":0,"policy_hash":"0x021f0e1133291eccccec9f5e5c30a9022eac26e0c7203c05548e5b607908d5f1","reserved_count":0,"reserved_use_units":0,"status":"0"},"baseline_id":"B1","contract_version":"phase3-adapter-contract-v1","evidence":{"pre_state_commitment":null,"record_fields_hash":null,"settlement_id":null,"settlement_record_count":0},"identity":{"authorization_nonce":1,"buyer_nonce":null,"object_state_version":1,"order_commitment_hash":"0x220544b0edb6add34ccf376e495b17189b2139669afa4532a94c457a6049884d","seller_nonce":1,"settlement_domain_id":"axc/p2/shared","settlement_protocol_version":1},"market":{"active_exposure_value":"0","active_orders":1,"capabilities":["TransferMeta","IssueRight","TransferRight"],"exists":true,"funded_orders":0,"market_id":"0xf1e1b1add3ea16ff2c83942fa072740be14523a5ca6bcbb8174cee6e7b6a1807","status":"0"},"meta":{"active_order_id":null,"active_right_count":0,"asset_id":"0x6262626262626262626262626262626262626262626262626262626262626262","exists":true,"owner":"0xd43593c715fdd31c61141abd04a99fd6822c8558854ccde39a5684e7a56da27d","owner_index_matches":true,"state_version":1,"status":"Tradable"},"observed_at":{"attempt_sequence":2,"block_number":18},"order":{"active_capacity_occupied":true,"buyer":null,"exists":true,"expiry":38,"funded_capacity_occupied":false,"grace_deadline":null,"operation":"IssueRight","order_id":"0x88194737c122fa7093f58df051b88da9a88cfbb5ee8e63eda19f6465f0a74db6","seller":"0xd43593c715fdd31c61141abd04a99fd6822c8558854ccde39a5684e7a56da27d","state":"Open"},"payment":{"buyer_balance":"100000000000000000","escrow_amount":"0","market_balance":"100000000000000000","royalty_balance":null,"safety_balance":null,"seller_balance":"1267650600227819258917591771206","state":"Unfunded"},"projection":{"authoritative":false,"availability":"N/A","order_state":null,"settlement_record_count":null},"right":{"active_order_id":null,"exists":false,"holder":null,"holder_index_matches":null,"parent_asset_id":null,"parent_index_matches":null,"remaining_uses":null,"right_id":null,"state_version":null,"status":null,"valid":null},"schema_id":"assetxchain-exp2-normalized-snapshot","schema_version":1,"state_commitment":"0x41e02e6d4e2f1eb837974ab563b45589f7fdb893a4cc3fa3edb469affa00c5a3"}
